{
  "$schema": "https://json-schema.org/draft/2020-12/schema",
  "title": "Linefield task package v1",
  "type": "object",
  "additionalProperties": false,
  "required": [
    "schemaVersion",
    "id",
    "title",
    "kind",
    "stage",
    "summary",
    "outcome",
    "nonGoals",
    "ownership",
    "integration",
    "pr",
    "dependencies",
    "authority",
    "security",
    "documents",
    "acceptance",
    "tests",
    "evidence",
    "handoff"
  ],
  "properties": {
    "schemaVersion": {
      "const": 1
    },
    "id": {
      "type": "string",
      "minLength": 1,
      "maxLength": 120,
      "pattern": "^[A-Za-z0-9][A-Za-z0-9._:-]*$"
    },
    "title": {
      "type": "string",
      "minLength": 1,
      "maxLength": 16000
    },
    "kind": {
      "enum": ["leaf", "milestone"]
    },
    "stage": {
      "enum": [
        "planned",
        "ready",
        "in-progress",
        "internal-review",
        "owner-review",
        "changes-requested",
        "blocked",
        "integration-pending",
        "done",
        "cancelled"
      ]
    },
    "summary": {
      "type": "string",
      "minLength": 1,
      "maxLength": 16000
    },
    "outcome": {
      "type": "string",
      "minLength": 1,
      "maxLength": 16000
    },
    "nonGoals": {
      "type": "array",
      "items": {
        "type": "string",
        "minLength": 1,
        "maxLength": 16000
      },
      "maxItems": 256
    },
    "ownership": {
      "type": "object",
      "additionalProperties": false,
      "required": ["branch", "baseRevision", "paths", "role"],
      "properties": {
        "branch": {
          "anyOf": [
            {
              "type": "string",
              "minLength": 1,
              "maxLength": 16000
            },
            {
              "type": "null"
            }
          ]
        },
        "baseRevision": {
          "type": "string",
          "pattern": "^[0-9a-f]{40}$"
        },
        "paths": {
          "type": "array",
          "items": {
            "type": "string",
            "minLength": 1,
            "maxLength": 500
          },
          "maxItems": 256
        },
        "role": {
          "type": "string",
          "minLength": 1,
          "maxLength": 16000
        }
      }
    },
    "integration": {
      "anyOf": [
        {
          "type": "object",
          "additionalProperties": false,
          "required": ["revision", "evidenceId"],
          "properties": {
            "revision": {
              "type": "string",
              "pattern": "^[0-9a-f]{40}$"
            },
            "evidenceId": {
              "type": "string",
              "minLength": 1,
              "maxLength": 120,
              "pattern": "^[A-Za-z0-9][A-Za-z0-9._:-]*$"
            }
          }
        },
        {
          "type": "null"
        }
      ]
    },
    "pr": {
      "anyOf": [
        {
          "type": "object",
          "additionalProperties": false,
          "required": [
            "repository",
            "number",
            "url",
            "observedState",
            "observedAt",
            "headRevision",
            "baseBranch",
            "mergeRevision"
          ],
          "properties": {
            "repository": {
              "type": "string",
              "minLength": 1,
              "maxLength": 16000,
              "pattern": "^[A-Za-z0-9_.-]+/[A-Za-z0-9_.-]+$"
            },
            "number": {
              "type": "integer",
              "minimum": 1,
              "maximum": 2147483647
            },
            "url": {
              "type": "string",
              "minLength": 1,
              "maxLength": 16000
            },
            "observedState": {
              "enum": ["open", "closed", "merged", "unknown"]
            },
            "observedAt": {
              "type": "string",
              "pattern": "^\\d{4}-\\d{2}-\\d{2}T\\d{2}:\\d{2}:\\d{2}(\\.\\d{1,3})?Z$"
            },
            "headRevision": {
              "anyOf": [
                {
                  "type": "string",
                  "pattern": "^[0-9a-f]{40}$"
                },
                {
                  "type": "null"
                }
              ]
            },
            "baseBranch": {
              "type": "string",
              "minLength": 1,
              "maxLength": 16000
            },
            "mergeRevision": {
              "anyOf": [
                {
                  "type": "string",
                  "pattern": "^[0-9a-f]{40}$"
                },
                {
                  "type": "null"
                }
              ]
            }
          }
        },
        {
          "type": "null"
        }
      ]
    },
    "dependencies": {
      "type": "array",
      "items": {
        "type": "object",
        "additionalProperties": false,
        "required": ["kind", "taskId", "reason", "revision"],
        "properties": {
          "kind": {
            "enum": ["hard", "contract", "independent"]
          },
          "taskId": {
            "type": "string",
            "minLength": 1,
            "maxLength": 120,
            "pattern": "^[A-Za-z0-9][A-Za-z0-9._:-]*$"
          },
          "reason": {
            "type": "string",
            "minLength": 1,
            "maxLength": 16000
          },
          "revision": {
            "anyOf": [
              {
                "type": "string",
                "pattern": "^[0-9a-f]{40}$"
              },
              {
                "type": "null"
              }
            ]
          }
        }
      },
      "maxItems": 256
    },
    "authority": {
      "type": "object",
      "additionalProperties": false,
      "required": ["implementation", "basis", "refs"],
      "properties": {
        "implementation": {
          "enum": ["authorized", "not-authorized", "conditional"]
        },
        "basis": {
          "type": "string",
          "minLength": 1,
          "maxLength": 16000
        },
        "refs": {
          "type": "array",
          "items": {
            "type": "string",
            "minLength": 1,
            "maxLength": 120,
            "pattern": "^[A-Za-z0-9][A-Za-z0-9._:-]*$"
          },
          "maxItems": 256
        }
      }
    },
    "security": {
      "type": "object",
      "additionalProperties": false,
      "required": ["classification", "summary"],
      "properties": {
        "classification": {
          "enum": [
            "not-assessed",
            "no-boundary-change",
            "existing-sensitive-boundary",
            "new-or-changed-boundary"
          ]
        },
        "summary": {
          "type": "string",
          "minLength": 1,
          "maxLength": 16000
        }
      }
    },
    "documents": {
      "type": "array",
      "items": {
        "type": "object",
        "additionalProperties": false,
        "required": ["id", "title", "kind", "path", "sha256", "artifactRevision"],
        "properties": {
          "id": {
            "type": "string",
            "minLength": 1,
            "maxLength": 120,
            "pattern": "^[A-Za-z0-9][A-Za-z0-9._:-]*$"
          },
          "title": {
            "type": "string",
            "minLength": 1,
            "maxLength": 16000
          },
          "kind": {
            "enum": ["brief", "design", "review", "decision", "contract", "handoff"]
          },
          "path": {
            "type": "string",
            "minLength": 1,
            "maxLength": 500
          },
          "sha256": {
            "type": "string",
            "pattern": "^[0-9a-f]{64}$"
          },
          "artifactRevision": {
            "anyOf": [
              {
                "type": "string",
                "pattern": "^[0-9a-f]{40}$"
              },
              {
                "type": "null"
              }
            ]
          }
        }
      },
      "maxItems": 256
    },
    "acceptance": {
      "type": "array",
      "items": {
        "type": "object",
        "additionalProperties": false,
        "required": ["id", "statement", "required", "scenarioIds", "testIds", "evidenceIds"],
        "properties": {
          "id": {
            "type": "string",
            "minLength": 1,
            "maxLength": 120,
            "pattern": "^[A-Za-z0-9][A-Za-z0-9._:-]*$"
          },
          "statement": {
            "type": "string",
            "minLength": 1,
            "maxLength": 16000
          },
          "required": {
            "type": "boolean"
          },
          "scenarioIds": {
            "type": "array",
            "items": {
              "type": "string",
              "minLength": 1,
              "maxLength": 120,
              "pattern": "^[A-Za-z0-9][A-Za-z0-9._:-]*$"
            },
            "maxItems": 256
          },
          "testIds": {
            "type": "array",
            "items": {
              "type": "string",
              "minLength": 1,
              "maxLength": 120,
              "pattern": "^[A-Za-z0-9][A-Za-z0-9._:-]*$"
            },
            "maxItems": 256
          },
          "evidenceIds": {
            "type": "array",
            "items": {
              "type": "string",
              "minLength": 1,
              "maxLength": 120,
              "pattern": "^[A-Za-z0-9][A-Za-z0-9._:-]*$"
            },
            "maxItems": 256
          }
        }
      },
      "maxItems": 256
    },
    "tests": {
      "type": "array",
      "items": {
        "type": "object",
        "additionalProperties": false,
        "required": ["id", "kind", "status", "path", "selector", "description"],
        "properties": {
          "id": {
            "type": "string",
            "minLength": 1,
            "maxLength": 120,
            "pattern": "^[A-Za-z0-9][A-Za-z0-9._:-]*$"
          },
          "kind": {
            "enum": ["unit", "integration", "browser", "native", "manual", "static"]
          },
          "status": {
            "enum": ["implemented", "planned", "manual"]
          },
          "path": {
            "anyOf": [
              {
                "type": "string",
                "minLength": 1,
                "maxLength": 500
              },
              {
                "type": "null"
              }
            ]
          },
          "selector": {
            "anyOf": [
              {
                "type": "string",
                "minLength": 1,
                "maxLength": 16000
              },
              {
                "type": "null"
              }
            ]
          },
          "description": {
            "type": "string",
            "minLength": 1,
            "maxLength": 16000
          }
        }
      },
      "maxItems": 256
    },
    "evidence": {
      "type": "array",
      "items": {
        "type": "object",
        "additionalProperties": false,
        "required": [
          "id",
          "title",
          "path",
          "sha256",
          "kind",
          "outcome",
          "runId",
          "sourceRevision",
          "sourceManifest",
          "recordedAt",
          "limitations",
          "artifactRevision"
        ],
        "properties": {
          "id": {
            "type": "string",
            "minLength": 1,
            "maxLength": 120,
            "pattern": "^[A-Za-z0-9][A-Za-z0-9._:-]*$"
          },
          "title": {
            "type": "string",
            "minLength": 1,
            "maxLength": 16000
          },
          "path": {
            "type": "string",
            "minLength": 1,
            "maxLength": 500
          },
          "sha256": {
            "type": "string",
            "pattern": "^[0-9a-f]{64}$"
          },
          "kind": {
            "enum": ["report", "log", "review", "manifest", "image", "fixture"]
          },
          "outcome": {
            "enum": ["passed", "failed", "skipped", "not-run", "mixed", "informational"]
          },
          "runId": {
            "type": "string",
            "minLength": 1,
            "maxLength": 120,
            "pattern": "^[A-Za-z0-9][A-Za-z0-9._:-]*$"
          },
          "sourceRevision": {
            "anyOf": [
              {
                "type": "string",
                "pattern": "^[0-9a-f]{40}$"
              },
              {
                "type": "null"
              }
            ]
          },
          "sourceManifest": {
            "anyOf": [
              {
                "type": "string",
                "minLength": 1,
                "maxLength": 500
              },
              {
                "type": "null"
              }
            ]
          },
          "recordedAt": {
            "anyOf": [
              {
                "type": "string",
                "pattern": "^\\d{4}-\\d{2}-\\d{2}T\\d{2}:\\d{2}:\\d{2}(\\.\\d{1,3})?Z$"
              },
              {
                "type": "null"
              }
            ]
          },
          "limitations": {
            "type": "array",
            "items": {
              "type": "string",
              "minLength": 1,
              "maxLength": 16000
            },
            "maxItems": 256
          },
          "artifactRevision": {
            "anyOf": [
              {
                "type": "string",
                "pattern": "^[0-9a-f]{40}$"
              },
              {
                "type": "null"
              }
            ]
          }
        }
      },
      "maxItems": 256
    },
    "handoff": {
      "type": "string",
      "minLength": 1,
      "maxLength": 16000
    }
  }
}
